StartDate,EndDate,Status,IPAddress,Progress,Duration (in seconds),Finished,RecordedDate,ResponseId,RecipientLastName,RecipientFirstName,RecipientEmail,ExternalReference,LocationLatitude,LocationLongitude,DistributionChannel,UserLanguage,consent,Q56_First Click,Q56_Last Click,Q56_Page Submit,Q56_Click Count,screen,Q57_First Click,Q57_Last Click,Q57_Page Submit,Q57_Click Count,years,comm_name,NFIP,no_NFIP,experience_1,experience_2,experience_3,experience_4,experience_5,future_1,future_2,future_3,future_4,future_5,Q60_First Click,Q60_Last Click,Q60_Page Submit,Q60_Click Count,currentmap,flood_zone,prepared,Q61_First Click,Q61_Last Click,Q61_Page Submit,Q61_Click Count,incr_no_flood,incr_sev_flood,Q62_First Click,Q62_Last Click,Q62_Page Submit,Q62_Click Count,lidaruse,interestlid,barrier_1,barrier_2,barrier_3,barrier_4,barrier_5,barrier_6,barrier_7,barrier_7_TEXT,usefulid,toolslid1,toolslid1_4_TEXT,Q58_First Click,Q58_Last Click,Q58_Page Submit,Q58_Click Count,accesslid,accesslid_7_TEXT,useslid,useslid_4_TEXT,toolslid,toolslid_4_TEXT,Q59_First Click,Q59_Last Click,Q59_Page Submit,Q59_Click Count,alter_names,alter_names_1_TEXT,alter_names_2_TEXT,alter_names_3_TEXT,alter_names_4_TEXT,alter_names_5_TEXT,alter_names_6_TEXT,alter_names_7_TEXT,alter_names_9_TEXT,Q64_First Click,Q64_Last Click,Q64_Page Submit,Q64_Click Count,comm_1,lidar_1,expertise_1_1,Q63_First Click,Q63_Last Click,Q63_Page Submit,Q63_Click Count,comm_2,lidar_2,expertise_2_1,Q184_First Click,Q184_Last Click,Q184_Page Submit,Q184_Click Count,comm_3,lidar_3,expertise_3_1,Q192_First Click,Q192_Last Click,Q192_Page Submit,Q192_Click Count,comm_4,lidar_4,expertise_4_1,Q200_First Click,Q200_Last Click,Q200_Page Submit,Q200_Click Count,comm_5,lidar_5,expertise_5_1,Q208_First Click,Q208_Last Click,Q208_Page Submit,Q208_Click Count,comm_6,lidar_6,expertise_6_1,Q216_First Click,Q216_Last Click,Q216_Page Submit,Q216_Click Count,comm_7,lidar_7,expertise_7_1,Q224_First Click,Q224_Last Click,Q224_Page Submit,Q224_Click Count,comm_8,lidar_8,expertise_8_1,Q232_First Click,Q232_Last Click,Q232_Page Submit,Q232_Click Count,soep_1,Q171_First Click,Q171_Last Click,Q171_Page Submit,Q171_Click Count,gender,gender_3_TEXT,age,education,degree,degree_7_TEXT,degree1,degree1_5_TEXT,degree2,degree2_5_TEXT,science_trust,gov_trust,gov_involve,Q56_First Click,Q56_Last Click,Q56_Page Submit,Q56_Click Count,Q67_First Click,Q67_Last Click,Q67_Page Submit,Q67_Click Count
Start Date,End Date,Response Type,IP Address,Progress,Duration (in seconds),Finished,Recorded Date,Response ID,Recipient Last Name,Recipient First Name,Recipient Email,External Data Reference,Location Latitude,Location Longitude,Distribution Channel,User Language,"Welcome to the Technology Adoption in Flood Risk Management Survey!
 
The purpose of this survey is to better understand how managers make decisions about flood risk management. You have been identified as a potential knowledgeable member of the industry who could provide information for our study. This survey will ask about you, the community you work in, and your use of lidar (Light Detection and Ranging) in flood risk management. Your response will contribute to our understanding of the role lidar plays in flood risk management, and help us identify barriers that may exist in its implementation. 

 

This survey should take less than 15 minutes to complete.

 

By selecting “I want to participate”, you are providing your consent to take part in this study. 


This survey is completely anonymous. No personally identifiable information will be associated with your responses in any reports resulting from this survey. Your participation is voluntary. If there are any items that you would prefer to skip, please leave the answer blank. You must be at least 18 years old to participate. 

  

For any questions, please contact the principal investigator: Tara Pozzi at tarapozzi@boisestate.edu or Dr. Vicken Hillis at vickenhillis@boisestate.edu.",Timing - First Click,Timing - Last Click,Timing - Page Submit,Timing - Click Count,This survey is intended for people who are involved in flood risk management in their professional work. Does this description fit your role?,Timing - First Click,Timing - Last Click,Timing - Page Submit,Timing - Click Count,How many years have you been working in flood risk management?,"What is the name of the community where you work in flood risk management? This can be a city, county, and/or watershed depending on what is most relevant to your work.","The National Flood Insurance Program (NFIP) is an agreement between local communities and the federal government to help communities adopt and enforce a floodplain management ordinance to reduce future flood risks.
Is your community currently enrolled in the NFIP?","Why is your
community not enrolled in the NFIP?",Have you ever experienced a flood that caused... - damage to property in your community?,Have you ever experienced a flood that caused... - deaths and injury to people in your community?,Have you ever experienced a flood that caused... - damage to your home?,Have you ever experienced a flood that caused... - deaths or injuries to you or members of your immediate family?,"Have you ever experienced a flood that caused... - disruption to your electric, water, phone, and other basic services?","Thinking about your community in the next 30 years, how likely is it that a flood will cause... - damage to property in your community?","Thinking about your community in the next 30 years, how likely is it that a flood will cause... - deaths and injury to people in your community?","Thinking about your community in the next 30 years, how likely is it that a flood will cause... - damage to your home?","Thinking about your community in the next 30 years, how likely is it that a flood will cause... - deaths or injuries to you or members of your immediate family?","Thinking about your community in the next 30 years, how likely is it that a flood will cause... - disruption to your electric, water, phone, and other basic services?",Timing - First Click,Timing - Last Click,Timing - Page Submit,Timing - Click Count,Do you think your community's floodplain maps accurately reflect flood risk?,"To your knowledge, are there any areas in your community that have flooded in the past, but are not designated in a flood zone on your current flood maps?","If you had to say, is your community prepared for a significant flood event?",Timing - First Click,Timing - Last Click,Timing - Page Submit,Timing - Click Count,"In the future, do you think the average number of flood events in your community will increase, decrease, or stay the same?","In the future, do you think the average severity of flood damage in your community will increase, decrease, or stay the same?",Timing - First Click,Timing - Last Click,Timing - Page Submit,Timing - Click Count,"Light
Detection and Ranging (lidar) is a laser-based technology that provides a
detailed map of the ground (bare earth), vegetation (canopy), and other models
of the earth’s surface.
Do you currently use lidar?",Would you and/or your organization be interested in learning more about lidar?,To what extent do you agree with each of the following statements? (Please check one response for each statement.) - Lidar is too expensive for my community to afford,To what extent do you agree with each of the following statements? (Please check one response for each statement.) - There is not enough expertise in my community to use lidar,To what extent do you agree with each of the following statements? (Please check one response for each statement.) - My community does not use lidar because it is sparsely populated,To what extent do you agree with each of the following statements? (Please check one response for each statement.) - My community does not use lidar because it has a low rate of economic development,To what extent do you agree with each of the following statements? (Please check one response for each statement.) - We do not use lidar in my community because there is little risk of flooding,To what extent do you agree with each of the following statements? (Please check one response for each statement.) - There is not enough political support in my community to make lidar use feasible,To what extent do you agree with each of the following statements? (Please check one response for each statement.) - Other:,To what extent do you agree with each of the following statements? (Please check one response for each statement.) - Other: - Text,How useful do you think lidar could be for the community where you work?,"There are a number of lidar
training tools available both online and in-person. All of them are free and
take 1-2 hours to complete. Which of the following training sessions would you
personally find to be the most helpful? - Selected Choice","There are a number of lidar
training tools available both online and in-person. All of them are free and
take 1-2 hours to complete. Which of the following training sessions would you
personally find to be the most helpful? - Other: - Text",Timing - First Click,Timing - Last Click,Timing - Page Submit,Timing - Click Count,Where do you access your lidar data? (Check all that apply.) - Selected Choice,Where do you access your lidar data? (Check all that apply.) - Other: - Text,What do you use lidar for? (Check all that apply.) - Selected Choice,What do you use lidar for? (Check all that apply.) - Other: - Text,There are a number of lidar training tools available both online and in-person. All of them are free and take 1-2 hours to complete. Which of the following training sessions would you personally find to be the most helpful? - Selected Choice,There are a number of lidar training tools available both online and in-person. All of them are free and take 1-2 hours to complete. Which of the following training sessions would you personally find to be the most helpful? - Other: - Text,Timing - First Click,Timing - Last Click,Timing - Page Submit,Timing - Click Count,"Looking back over the last 12 months, who are the people with whom you discussed significant matters regarding flood risk management? Please list up to eight people, naming only their initials in order to keep them anonymous. - Selected Choice","Looking back over the last 12 months, who are the people with whom you discussed significant matters regarding flood risk management? Please list up to eight people, naming only their initials in order to keep them anonymous. - Person's initials (1): - Text","Looking back over the last 12 months, who are the people with whom you discussed significant matters regarding flood risk management? Please list up to eight people, naming only their initials in order to keep them anonymous. - Person's initials (2): - Text","Looking back over the last 12 months, who are the people with whom you discussed significant matters regarding flood risk management? Please list up to eight people, naming only their initials in order to keep them anonymous. - Person's initials (3): - Text","Looking back over the last 12 months, who are the people with whom you discussed significant matters regarding flood risk management? Please list up to eight people, naming only their initials in order to keep them anonymous. - Person's initials (4): - Text","Looking back over the last 12 months, who are the people with whom you discussed significant matters regarding flood risk management? Please list up to eight people, naming only their initials in order to keep them anonymous. - Person's initials (5): - Text","Looking back over the last 12 months, who are the people with whom you discussed significant matters regarding flood risk management? Please list up to eight people, naming only their initials in order to keep them anonymous. - Person's initials (6): - Text","Looking back over the last 12 months, who are the people with whom you discussed significant matters regarding flood risk management? Please list up to eight people, naming only their initials in order to keep them anonymous. - Person's initials (7): - Text","Looking back over the last 12 months, who are the people with whom you discussed significant matters regarding flood risk management? Please list up to eight people, naming only their initials in order to keep them anonymous. - Person's initials (8): - Text",Timing - First Click,Timing - Last Click,Timing - Page Submit,Timing - Click Count,"How often do you communicate (e.g. in-person, online, over the phone) with [QID89-ChoiceTextEntryValue-1]?","To your knowledge, does [QID89-ChoiceTextEntryValue-1] use lidar?","On a scale from 0 to 10, how would you rate the expertise of [QID89-ChoiceTextEntryValue-1] in the field of flood risk management? - On a scale from 0 to 10, how would you rate the expertise of ${q://QID89/ChoiceTextEntryValue/1} in the field of flood risk management?",Timing - First Click,Timing - Last Click,Timing - Page Submit,Timing - Click Count,"How often do you communicate (e.g. in-person, online, over the phone) with [QID89-ChoiceTextEntryValue-2]?","To your knowledge, does [QID89-ChoiceTextEntryValue-2] use lidar?","On a scale from 0 to 10, how would you rate the expertise of [QID89-ChoiceTextEntryValue-2] in the field of flood risk management? - On a scale from 0 to 10, how would you rate the expertise of ${q://QID89/ChoiceTextEntryValue/2} in the field of flood risk management?",Timing - First Click,Timing - Last Click,Timing - Page Submit,Timing - Click Count,"How often do you communicate (e.g. in-person, online, over the phone) with [QID89-ChoiceTextEntryValue-3]?","To your knowledge, does [QID89-ChoiceTextEntryValue-3] use lidar?","On a scale from 0 to 10, how would you rate the expertise of [QID89-ChoiceTextEntryValue-3] in the field of flood risk management? - On a scale from 0 to 10, how would you rate the expertise of ${q://QID89/ChoiceTextEntryValue/3} in the field of flood risk management?",Timing - First Click,Timing - Last Click,Timing - Page Submit,Timing - Click Count,"How often do you communicate (e.g. in-person, online, over the phone) with [QID89-ChoiceTextEntryValue-4]?","To your knowledge, does [QID89-ChoiceTextEntryValue-4] use lidar?","On a scale from 0 to 10, how would you rate the expertise of [QID89-ChoiceTextEntryValue-4] in the field of flood risk management? - On a scale from 0 to 10, how would you rate the expertise of ${q://QID89/ChoiceTextEntryValue/4} in the field of flood risk management?",Timing - First Click,Timing - Last Click,Timing - Page Submit,Timing - Click Count,"How often do you communicate (e.g. in-person, online, over the phone) with [QID89-ChoiceTextEntryValue-5]?","To your knowledge, does [QID89-ChoiceTextEntryValue-5] use lidar?","On a scale from 0 to 10, how would you rate the expertise of [QID89-ChoiceTextEntryValue-5] in the field of flood risk management? - On a scale from 0 to 10, how would you rate the expertise of ${q://QID89/ChoiceTextEntryValue/5} in the field of flood risk management?",Timing - First Click,Timing - Last Click,Timing - Page Submit,Timing - Click Count,"How often do you communicate (e.g. in-person, online, over the phone) with [QID89-ChoiceTextEntryValue-6]?","To your knowledge, does [QID89-ChoiceTextEntryValue-6] use lidar?","On a scale from 0 to 10, how would you rate the expertise of [QID89-ChoiceTextEntryValue-6] in the field of flood risk management? - On a scale from 0 to 10, how would you rate the expertise of ${q://QID89/ChoiceTextEntryValue/6} in the field of flood risk management?",Timing - First Click,Timing - Last Click,Timing - Page Submit,Timing - Click Count,"How often do you communicate (e.g. in-person, online, over the phone) with [QID89-ChoiceTextEntryValue-7]?","To your knowledge, does [QID89-ChoiceTextEntryValue-7] use lidar?","On a scale from 0 to 10, how would you rate the expertise of [QID89-ChoiceTextEntryValue-7] in the field of flood risk management? - On a scale from 0 to 10, how would you rate the expertise of ${q://QID89/ChoiceTextEntryValue/7} in the field of flood risk management?",Timing - First Click,Timing - Last Click,Timing - Page Submit,Timing - Click Count,"How often do you communicate (e.g. in-person, online, over the phone) with [QID89-ChoiceTextEntryValue-8]?","To your knowledge, does [QID89-ChoiceTextEntryValue-8] use lidar?","On a scale from 0 to 10, how would you rate the expertise of [QID89-ChoiceTextEntryValue-8] in the field of flood risk management? - On a scale from 0 to 10, how would you rate the expertise of ${q://QID89/ChoiceTextEntryValue/8} in the field of flood risk management?",Timing - First Click,Timing - Last Click,Timing - Page Submit,Timing - Click Count,"Do you generally prefer to
take risks or to avoid risks? - 1",Timing - First Click,Timing - Last Click,Timing - Page Submit,Timing - Click Count,What gender do you identify with? - Selected Choice,What gender do you identify with? - Prefer to self-describe: - Text,What is your age?,What is the highest level of education you have completed?,What was your degree? - Selected Choice,What was your degree? - Other: - Text,What was your degree? - Selected Choice,What was your degree? - Other: - Text,What was your degree? - Selected Choice,What was your degree? - Other: - Text,"How much do you trust the accuracy of scientific products for flood risk management (i.e. topographic data, floodplain mapping, floodplain modeling)?","How much do you trust or
distrust the usefulness of the products the federal government develops with
respect to flood risk management (i.e. data collection, accurate mapping,
floodplain modeling, flood insurance)?",How involved do you think the federal government should be with flood risk management (i.e. accurate,Timing - First Click,Timing - Last Click,Timing - Page Submit,Timing - Click Count,Timing - First Click,Timing - Last Click,Timing - Page Submit,Timing - Click Count
"{""ImportId"":""startDate"",""timeZone"":""America/Denver""}","{""ImportId"":""endDate"",""timeZone"":""America/Denver""}","{""ImportId"":""status""}","{""ImportId"":""ipAddress""}","{""ImportId"":""progress""}","{""ImportId"":""duration""}","{""ImportId"":""finished""}","{""ImportId"":""recordedDate"",""timeZone"":""America/Denver""}","{""ImportId"":""_recordId""}","{""ImportId"":""recipientLastName""}","{""ImportId"":""recipientFirstName""}","{""ImportId"":""recipientEmail""}","{""ImportId"":""externalDataReference""}","{""ImportId"":""locationLatitude""}","{""ImportId"":""locationLongitude""}","{""ImportId"":""distributionChannel""}","{""ImportId"":""userLanguage""}","{""ImportId"":""QID1""}","{""ImportId"":""QID71_FIRST_CLICK""}","{""ImportId"":""QID71_LAST_CLICK""}","{""ImportId"":""QID71_PAGE_SUBMIT""}","{""ImportId"":""QID71_CLICK_COUNT""}","{""ImportId"":""QID2""}","{""ImportId"":""QID72_FIRST_CLICK""}","{""ImportId"":""QID72_LAST_CLICK""}","{""ImportId"":""QID72_PAGE_SUBMIT""}","{""ImportId"":""QID72_CLICK_COUNT""}","{""ImportId"":""QID5_TEXT""}","{""ImportId"":""QID130_TEXT""}","{""ImportId"":""QID50""}","{""ImportId"":""QID150_TEXT""}","{""ImportId"":""QID233_1""}","{""ImportId"":""QID233_2""}","{""ImportId"":""QID233_3""}","{""ImportId"":""QID233_4""}","{""ImportId"":""QID233_5""}","{""ImportId"":""QID234_1""}","{""ImportId"":""QID234_2""}","{""ImportId"":""QID234_3""}","{""ImportId"":""QID234_4""}","{""ImportId"":""QID234_5""}","{""ImportId"":""QID75_FIRST_CLICK""}","{""ImportId"":""QID75_LAST_CLICK""}","{""ImportId"":""QID75_PAGE_SUBMIT""}","{""ImportId"":""QID75_CLICK_COUNT""}","{""ImportId"":""QID23""}","{""ImportId"":""QID132""}","{""ImportId"":""QID37""}","{""ImportId"":""QID76_FIRST_CLICK""}","{""ImportId"":""QID76_LAST_CLICK""}","{""ImportId"":""QID76_PAGE_SUBMIT""}","{""ImportId"":""QID76_CLICK_COUNT""}","{""ImportId"":""QID34""}","{""ImportId"":""QID131""}","{""ImportId"":""QID77_FIRST_CLICK""}","{""ImportId"":""QID77_LAST_CLICK""}","{""ImportId"":""QID77_PAGE_SUBMIT""}","{""ImportId"":""QID77_CLICK_COUNT""}","{""ImportId"":""QID8""}","{""ImportId"":""QID19""}","{""ImportId"":""QID16_1""}","{""ImportId"":""QID16_2""}","{""ImportId"":""QID16_3""}","{""ImportId"":""QID16_4""}","{""ImportId"":""QID16_5""}","{""ImportId"":""QID16_6""}","{""ImportId"":""QID16_7""}","{""ImportId"":""QID16_7_TEXT""}","{""ImportId"":""QID17""}","{""ImportId"":""QID18""}","{""ImportId"":""QID18_4_TEXT""}","{""ImportId"":""QID73_FIRST_CLICK""}","{""ImportId"":""QID73_LAST_CLICK""}","{""ImportId"":""QID73_PAGE_SUBMIT""}","{""ImportId"":""QID73_CLICK_COUNT""}","{""ImportId"":""QID10""}","{""ImportId"":""QID10_7_TEXT""}","{""ImportId"":""QID12""}","{""ImportId"":""QID12_4_TEXT""}","{""ImportId"":""QID15""}","{""ImportId"":""QID15_4_TEXT""}","{""ImportId"":""QID74_FIRST_CLICK""}","{""ImportId"":""QID74_LAST_CLICK""}","{""ImportId"":""QID74_PAGE_SUBMIT""}","{""ImportId"":""QID74_CLICK_COUNT""}","{""ImportId"":""QID89""}","{""ImportId"":""QID89_1_TEXT""}","{""ImportId"":""QID89_2_TEXT""}","{""ImportId"":""QID89_3_TEXT""}","{""ImportId"":""QID89_4_TEXT""}","{""ImportId"":""QID89_5_TEXT""}","{""ImportId"":""QID89_6_TEXT""}","{""ImportId"":""QID89_7_TEXT""}","{""ImportId"":""QID89_9_TEXT""}","{""ImportId"":""QID96_FIRST_CLICK""}","{""ImportId"":""QID96_LAST_CLICK""}","{""ImportId"":""QID96_PAGE_SUBMIT""}","{""ImportId"":""QID96_CLICK_COUNT""}","{""ImportId"":""QID91""}","{""ImportId"":""QID138""}","{""ImportId"":""QID175_1""}","{""ImportId"":""QID95_FIRST_CLICK""}","{""ImportId"":""QID95_LAST_CLICK""}","{""ImportId"":""QID95_PAGE_SUBMIT""}","{""ImportId"":""QID95_CLICK_COUNT""}","{""ImportId"":""QID177""}","{""ImportId"":""QID180""}","{""ImportId"":""QID182_1""}","{""ImportId"":""QID184_FIRST_CLICK""}","{""ImportId"":""QID184_LAST_CLICK""}","{""ImportId"":""QID184_PAGE_SUBMIT""}","{""ImportId"":""QID184_CLICK_COUNT""}","{""ImportId"":""QID185""}","{""ImportId"":""QID188""}","{""ImportId"":""QID190_1""}","{""ImportId"":""QID192_FIRST_CLICK""}","{""ImportId"":""QID192_LAST_CLICK""}","{""ImportId"":""QID192_PAGE_SUBMIT""}","{""ImportId"":""QID192_CLICK_COUNT""}","{""ImportId"":""QID193""}","{""ImportId"":""QID196""}","{""ImportId"":""QID198_1""}","{""ImportId"":""QID200_FIRST_CLICK""}","{""ImportId"":""QID200_LAST_CLICK""}","{""ImportId"":""QID200_PAGE_SUBMIT""}","{""ImportId"":""QID200_CLICK_COUNT""}","{""ImportId"":""QID201""}","{""ImportId"":""QID204""}","{""ImportId"":""QID206_1""}","{""ImportId"":""QID208_FIRST_CLICK""}","{""ImportId"":""QID208_LAST_CLICK""}","{""ImportId"":""QID208_PAGE_SUBMIT""}","{""ImportId"":""QID208_CLICK_COUNT""}","{""ImportId"":""QID209""}","{""ImportId"":""QID212""}","{""ImportId"":""QID214_1""}","{""ImportId"":""QID216_FIRST_CLICK""}","{""ImportId"":""QID216_LAST_CLICK""}","{""ImportId"":""QID216_PAGE_SUBMIT""}","{""ImportId"":""QID216_CLICK_COUNT""}","{""ImportId"":""QID217""}","{""ImportId"":""QID220""}","{""ImportId"":""QID222_1""}","{""ImportId"":""QID224_FIRST_CLICK""}","{""ImportId"":""QID224_LAST_CLICK""}","{""ImportId"":""QID224_PAGE_SUBMIT""}","{""ImportId"":""QID224_CLICK_COUNT""}","{""ImportId"":""QID225""}","{""ImportId"":""QID228""}","{""ImportId"":""QID230_1""}","{""ImportId"":""QID232_FIRST_CLICK""}","{""ImportId"":""QID232_LAST_CLICK""}","{""ImportId"":""QID232_PAGE_SUBMIT""}","{""ImportId"":""QID232_CLICK_COUNT""}","{""ImportId"":""QID170_1""}","{""ImportId"":""QID171_FIRST_CLICK""}","{""ImportId"":""QID171_LAST_CLICK""}","{""ImportId"":""QID171_PAGE_SUBMIT""}","{""ImportId"":""QID171_CLICK_COUNT""}","{""ImportId"":""QID39""}","{""ImportId"":""QID39_3_TEXT""}","{""ImportId"":""QID40""}","{""ImportId"":""QID41""}","{""ImportId"":""QID42""}","{""ImportId"":""QID42_7_TEXT""}","{""ImportId"":""QID43""}","{""ImportId"":""QID43_5_TEXT""}","{""ImportId"":""QID44""}","{""ImportId"":""QID44_5_TEXT""}","{""ImportId"":""QID85""}","{""ImportId"":""QID137""}","{""ImportId"":""QID86""}","{""ImportId"":""QID88_FIRST_CLICK""}","{""ImportId"":""QID88_LAST_CLICK""}","{""ImportId"":""QID88_PAGE_SUBMIT""}","{""ImportId"":""QID88_CLICK_COUNT""}","{""ImportId"":""QID82_FIRST_CLICK""}","{""ImportId"":""QID82_LAST_CLICK""}","{""ImportId"":""QID82_PAGE_SUBMIT""}","{""ImportId"":""QID82_CLICK_COUNT""}"
2020-06-30 17:30:27,2020-06-30 17:30:54,0,209.161.163.47,100,26,1,2020-06-30 17:30:54,R_31i2pc6drcE3LpZ,Nylund,Paul,pnylund@valdezak.gov,,61.1009979248046875,-146.899993896484375,email,EN,1,12.253,12.253,13.55,1,2,,,,,,,,,,,,,,,,,,,,,,,,,,,,,,,,,,,,,,,,,,,,,,,,,,,,,,,,,,,,,,,,,,,,,,,,,,,,,,,,,,,,,,,,,,,,,,,,,,,,,,,,,,,,,,,,,,,,,,,,,,,,,,,,,,,,,,,,,,,,,,,,,,,,,,,,,,,,,
2020-07-07 11:15:26,2020-07-07 11:23:16,0,72.170.208.115,100,469,1,2020-07-07 11:23:16,R_25YqC0GKyb5sI5k,Erickson,John,manager@yakutatak.us,,59.8119964599609375,-139.550506591796875,email,EN,1,3.581,3.581,6.562,1,1,,,,,10,,2,not in a flood zone,1,2,2,2,2,18,16,17,17,20,10.826,62.91,66.02,11,1,2,3,6.957,27.163,29.515,3,3,3,,,,,3,1,,,,,,,,,,,,,,,,,,,,,,,,,,1,JE,,,,,,,,6.21,7.278,15.994,2,8,2,6,23.968,42.61,43.94,4,,,,,,,,,,,,,,,,,,,,,,,,,,,,,,,,,,,,,,,,,,,,,,,,,,10,14.78,14.78,15.953,1,1,,5,7,,,,,4,,1,1,1,64.689,80.211,83.241,3,0,0,12.675,0
2020-07-07 11:46:53,2020-07-07 11:52:53,0,64.186.126.13,100,359,1,2020-07-07 11:52:53,R_1jJT0Y43IjnhAvK,Deach,Emily,e.deach@skagway.org,,56.9718017578125,-133.940399169921875,email,EN,1,13.04,13.04,14.405,1,1,,,,,10,"Municipality of Skagway, Alaska",1,,1,2,2,2,2,17,16,16,16,16,5.789,32.997,34.079,10,8,1,2,9.271,21.255,23.073,3,1,3,,,,,1,,,,,,,,,,,,,,,,,"1,2",,7,,2,,4.163,32.355,41.453,4,"1,2",SR,BR,,,,,,,15.826,20.751,69.779,4,9,1,4,6.492,18.448,21.262,4,9,1,7,2.9,11.279,12.525,3,,,,,,,,,,,,,,,,,,,,,,,,,,,,,,,,,,,,,,,,,,,9,6.801,6.801,8.069,1,2,,4,7,,,,,5,MA in History & Culture,1,1,7,5.534,25.39,26.641,3,0,0,2.612,0
